<?xml version="1.0" encoding="UTF-8"?>
<CMD_ComponentSpec xmlns:xsi="http://www.w3.org/2001/XMLSchema-instance"
    xsi:noNamespaceSchemaLocation="file:../../general-component-schema.xsd">
    <Header></Header>
    <CMD_Component name="Collection" CardinalityMin="1" CardinalityMax="1">
        <CMD_Element name="Name" ValueScheme="string" CardinalityMin="1" CardinalityMax="1" ConceptLink="http://www.isocat.org/datcat/DC-2544"></CMD_Element>
        <CMD_Element name="Title" ValueScheme="string" ConceptLink="http://www.isocat.org/datcat/DC-2545"></CMD_Element>
        <CMD_Element name="ID" ValueScheme="string" ConceptLink="http://www.isocat.org/datcat/DC-2573"></CMD_Element>
        <CMD_Element name="Version" ValueScheme="string" ConceptLink="http://www.isocat.org/datcat/DC-2547"></CMD_Element>
        <CMD_Element name="TimeCoverage" ValueScheme="string" ConceptLink="http://www.isocat.org/datcat/DC-2502"></CMD_Element>
        <CMD_Element name="Description" ValueScheme="string" CardinalityMin="1" CardinalityMax="1" ConceptLink="http://www.isocat.org/datcat/DC-2520"></CMD_Element>
        <CMD_Element name="PublicationDate" CardinalityMin="0" CardinalityMax="1" ConceptLink="http://www.isocat.org/datcat/DC-2538">
            <ValueScheme>
                <pattern>(1|2)\d{3}-(0[1-9]|1[012])-(0[1-9]|[12][0-9]|3[01])</pattern>                
            </ValueScheme>
        </CMD_Element>
        <CMD_Component filename="component-size.xml"></CMD_Component>
        <CMD_Component filename="component-project.xml"></CMD_Component>
        <CMD_Component filename="component-creators.xml"></CMD_Component>
        <CMD_Component filename="component-subjectlanguages.xml"></CMD_Component>
        <CMD_Component filename="component-documentlanguages.xml"></CMD_Component>
        <CMD_Component filename="../clarin/cmdi-location.xml"></CMD_Component>
        <CMD_Component filename="component-collectiontype.xml"></CMD_Component>
        <CMD_Component filename="component-access.xml"></CMD_Component>   
        <CMD_Component filename="component-validation.xml"></CMD_Component>
    </CMD_Component>
</CMD_ComponentSpec>
