<?xml version="1.0" encoding="UTF-8"?>

<CMD_ComponentSpec xmlns:xsi="http://www.w3.org/2001/XMLSchema-instance"
    xsi:noNamespaceSchemaLocation="../../general-component-schema.xsd" isProfile="false">
    
    <Header/>
    
    <CMD_Component name="MDGroup" CardinalityMin="1" CardinalityMax="1">
        <CMD_Component filename="component-location.xml" />
        <CMD_Component filename="component-project.xml" />
        <CMD_Component filename="component-keys.xml" />
        <CMD_Component filename="component-content.xml" />
        <CMD_Component filename="component-actors.xml" />
    </CMD_Component>

</CMD_ComponentSpec>
