<?xml version="1.0" encoding="UTF-8"?>

<CMD_ComponentSpec xmlns:xsi="http://www.w3.org/2001/XMLSchema-instance"
    xsi:noNamespaceSchemaLocation="../general-component-schema.xsd" isProfile="false">
    
    <Header/>
    
    <CMD_Component name="Actor" CardinalityMin="0" CardinalityMax="unbounded" ComponentId="eu.clarin.mdcomponent.actor">
        
        <CMD_Element name="firstName" ValueScheme="string" Documentation="This is the firstname of a person" DisplayPriority="0">
            <!-- provide a nickname attribute for the firstName element -->
            <AttributeList>
                <!-- example of an attribute using a simple type -->
                <Attribute>
                    <Name>nickname</Name>
                    <Type>string</Type>
                </Attribute>
                <!-- example of an attribute using an enumeration  (could also be a pattern) -->
                <Attribute >
                    <Name>suffix</Name>
                    <ValueScheme>
                        <enumeration>
                            <item ConceptLink="http://www.isocat.org/datcat/CMD-001">senior</item>
                            <item ConceptLink="http://www.isocat.org/datcat/CMD-002">junior</item>
                        </enumeration>
                    </ValueScheme>
                </Attribute>
            </AttributeList>
        </CMD_Element>
        
        <CMD_Element name="lastName" ValueScheme="string" DisplayPriority="1"/>
        
        <CMD_Element name="sex" ConceptLink="http://www.isocat.org/datcat/CMD-000" ValueScheme="anyURI">
            <ValueScheme>
                <enumeration>
                    <item ConceptLink="http://www.isocat.org/datcat/CMD-0010">male</item>
                    <item ConceptLink="http://www.isocat.org/datcat/CMD-001">female</item>
                </enumeration>
            </ValueScheme>
        </CMD_Element>
        <CMD_Element name="age" ConceptLink="http://www.isocat.org/datcat/CMD-000">
            <ValueScheme>
                <pattern>([0-9]+)*(;[0-9]+)*(.[0-9]+)</pattern>
            </ValueScheme>
        </CMD_Element>

        <CMD_Component ConceptLink="http://www.isocat.org/datcat/CMD-000" name="ActorLanguage" CardinalityMin="0" CardinalityMax="unbounded">
            <!-- inline element definitions -->
            <CMD_Element name="ActorLanguageName" ValueScheme="string"
                ConceptLink="http://www.isocat.org/datcat/DC-1766"/>
        </CMD_Component>

    </CMD_Component>

</CMD_ComponentSpec>
