<?xml version="1.0" encoding="UTF-8"?>
<CMD_ComponentSpec xmlns:xsi="http://www.w3.org/2001/XMLSchema-instance"
    xsi:noNamespaceSchemaLocation="file:/home/dietuyt/svn/clarin/metadata/trunk/toolkit/general-component-schema.xsd">
    <Header></Header>
    <CMD_Component>
        
        <!-- where do the texts come from? eg newspaper, internet, etc -->
        <CMD_Element name="origin" ValueScheme="string"/>   
        
        <CMD_Component name="TextTechnicalMetadata" CardinalityMin="0" CardinalityMax="unbounded" >
            <CMD_Element name="CharacterEncoding" ValueScheme="string" ConceptLink="http://www.isocat.org/datcat/DC-2564"/>
            <CMD_Component filename="contentencoding.xml"/>
            <CMD_Component name="mimetype">
                <!-- TODO: create mimetype component -->
            </CMD_Component>
        </CMD_Component>
        
        <CMD_Component filename="component-validation.xml"/>
        
    </CMD_Component>

</CMD_ComponentSpec>
