<?xml version="1.0" encoding="UTF-8"?>
<CMD_ComponentSpec xmlns:xsi="http://www.w3.org/2001/XMLSchema-instance"
    xsi:noNamespaceSchemaLocation="../../general-component-schema.xsd">
    
    <Header/>
    
    <CMD_Component name="Project" CardinalityMin="1" CardinalityMax="1">
        
        <CMD_Element name="Name" ValueScheme="string" ConceptLink="http://www.isocat.org/datcat/DC-2536"/>
        <CMD_Element name="Title" ValueScheme="string" ConceptLink="http://www.isocat.org/datcat/DC-2537"/>
        <CMD_Element name="Id" ValueScheme="string"  ConceptLink="http://www.isocat.org/datcat/DC-2535"/>
        <CMD_Component filename="component-contact.xml" />
        <CMD_Component filename="component-description.xml" />
        
    </CMD_Component>
    
</CMD_ComponentSpec>
