<?xml version="1.0" encoding="UTF-8"?>

<CMD_ComponentSpec xmlns:xsi="http://www.w3.org/2001/XMLSchema-instance"
    xsi:noNamespaceSchemaLocation="../../general-component-schema.xsd">
    
    <Header/>
    
    <CMD_Component name="Session" CardinalityMin="1" CardinalityMax="1">
        <CMD_Element name="Name" ValueScheme="string" ConceptLink="http://www.isocat.org/datcat/DC-2544"/>
        <CMD_Element name="Title" ValueScheme="string" ConceptLink="http://www.isocat.org/datcat/DC-2545"/>
        <CMD_Element name="Date" ConceptLink="http://www.isocat.org/datcat/DC-2510">
            <ValueScheme>
                <!-- matching dates of the pattern yyyy-mm-dd (ISO 8601); copied from IMDI schema -->
                <pattern>([0-9]+)((-[0-9]+)(-[0-9]+)?)?(/([0-9]+)((-[0-9]+)(-[0-9]+)?)?)?|Unknown|Unspecified</pattern>                
            </ValueScheme>
        </CMD_Element>
        <CMD_Component filename="component-description.xml" />
        <CMD_Component filename="component-mdgroup.xml" />
        <CMD_Component filename="component-resources.xml" />
        <CMD_Component filename="component-references.xml" />
        
    </CMD_Component>

</CMD_ComponentSpec>

