<?xml version="1.0" encoding="UTF-8"?>
<CMD_ComponentSpec xmlns:xsi="http://www.w3.org/2001/XMLSchema-instance"
    xsi:noNamespaceSchemaLocation="../../../general-component-schema.xsd" isProfile="false">
    <Header>
        <ID>eu.clarin.cmdi.webservice.parameter</ID>
        <Name>Parameter</Name>
        <Description>The Parameter Component specifies the metadata associated with the parameters. It describes the name of the parameter and its type. If the type is a XML complex type the URL refers to the schema location</Description>
    </Header>
    
    <CMD_Component name="parameter">
                
        <CMD_Element name="Name" ValueScheme="string" />
        <CMD_Element name="Type" ValueScheme="string" />
        <CMD_Element name="URL" ValueScheme="anyURI" ConceptLink="http://www.isocat.org/datcat/DC-2546"/>
                
        <CMD_Component filename="technicalmetadata.xml"/>
        
    </CMD_Component>
</CMD_ComponentSpec>
