<?xml version="1.0" encoding="UTF-8"?>
<CMD_ComponentSpec xmlns:xsi="http://www.w3.org/2001/XMLSchema-instance"
                   xsi:schemaLocation="http://www.clarin.eu/cmd http://www.clarin.eu/cmd/general-component-schema.xsd"
                   isProfile="false">
    <Header/>
    <CMD_Component name="Access" CardinalityMin="1" CardinalityMax="unbounded">
        <CMD_Element name="Availability" ValueScheme="string" CardinalityMin="1" CardinalityMax="1"
                   ConceptLink="http://www.isocat.org/datcat/DC-2453/"/>
        <CMD_Element name="Owner" CardinalityMin="0" ValueScheme="string"/>
        <CMD_Element name="DistributionForm" CardinalityMin="0" CardinalityMax="unbounded"
                   ValueScheme="string"/>
        <CMD_Element name="Rights" CardinalityMin="0"
                   ConceptLink="http://www.isocat.org/datcat/DC-2457"/>
        <CMD_Element name="CatalogueLink" CardinalityMin="1" CardinalityMax="unbounded"
                   ValueScheme="anyURI"/>  
        <CMD_Component filename="component-contactpublisher.xml" CardinalityMin="1"
                     CardinalityMax="unbounded"/>
        <CMD_Component filename="component-price.xml" CardinalityMin="0" CardinalityMax="unbounded"
                     ConceptLink="http://www.isocat.org/datcat/DC-2460"/>
    </CMD_Component>    
</CMD_ComponentSpec>
