<?xml version="1.0" encoding="UTF-8"?>
<CMD_ComponentSpec xmlns:xsi="http://www.w3.org/2001/XMLSchema-instance"
    xsi:noNamespaceSchemaLocation="file:/C:/Metadataproject/TOOLKIT/general-component-schema.xsd" isProfile="false">
    <Header></Header>
    <CMD_Component name="Project" CardinalityMin="0">
        <CMD_Element name="Name" ValueScheme="string" ConceptLink="http://www.isocat.org/datcat/DC-2536"></CMD_Element>
        <CMD_Element name="Title" ValueScheme="string" ConceptLink="http://www.isocat.org/datcat/DC-2537"></CMD_Element>
        <CMD_Element name="ID" ValueScheme="string" ConceptLink="http://www.isocat.org/datcat/DC-2535"></CMD_Element>
        <CMD_Element name="Funder" ValueScheme="string" ConceptLink="http://www.isocat.org/datcat/DC-2522"></CMD_Element>
        <CMD_Element name="Description" ValueScheme="string" CardinalityMin="1" CardinalityMax="1" ConceptLink="http://www.isocat.org/datcat/DC-2520"></CMD_Element>
        <CMD_Component filename="component-contact.xml"></CMD_Component>
        <CMD_Component filename="component-duration.xml"></CMD_Component>
    </CMD_Component>
</CMD_ComponentSpec>
