<?xml version="1.0" encoding="UTF-8"?>

<CMD_ComponentSpec xmlns:xsi="http://www.w3.org/2001/XMLSchema-instance"
    xsi:noNamespaceSchemaLocation="../../general-component-schema.xsd" isProfile="false">
    
    <Header/>
    
    <CMD_Component name="Keys" CardinalityMin="1" CardinalityMax="1">
        <CMD_Element name="Key" ValueScheme="string" CardinalityMin="0" CardinalityMax="unbounded">
            <AttributeList>
                <Attribute>
                    <Name>Name</Name>
                    <Type>string</Type>
                </Attribute>
            </AttributeList>
            
        </CMD_Element>
        
    </CMD_Component>

</CMD_ComponentSpec>
